[
  {
    "id": "bb-2026-01",
    "title": "Bac blanc n°1",
    "subtitle": "Sujet d'entraînement — début d'année (accessible)",
    "order": 1,
    "durationMinutes": 120,
    "part1": {
      "title": "Partie 1 — Automatismes",
      "description": "10 questions d'automatismes, sans calculatrice, ~20 minutes recommandées.",
      "totalMarks": 6,
      "automatismIds": [
        "a-bb1-001",
        "a-bb1-002",
        "a-bb1-003",
        "a-bb1-004",
        "a-bb1-005",
        "a-bb1-006",
        "a-bb1-007",
        "a-bb1-008",
        "a-bb1-009",
        "a-bb1-010"
      ]
    },
    "part2": {
      "title": "Partie 2 — Exercices",
      "description": "Deux exercices indépendants, ~1h40 recommandées au total.",
      "totalMarks": 14,
      "exerciseIds": ["e-transverse-bb1-001", "e-transverse-bb1-002"]
    },
    "tags": ["accessible", "debut-annee"]
  },
  {
    "id": "bb-2026-02",
    "title": "Bac blanc n°2",
    "subtitle": "Sujet d'entraînement — mi-parcours (calqué sur les sujets zéro EAM 2026)",
    "order": 2,
    "durationMinutes": 120,
    "part1": {
      "title": "Partie 1 — Automatismes",
      "description": "10 questions d'automatismes, sans calculatrice, ~20 minutes recommandées.",
      "totalMarks": 6,
      "automatismIds": [
        "a-bb2-001",
        "a-bb2-002",
        "a-bb2-003",
        "a-bb2-004",
        "a-bb2-005",
        "a-bb2-006",
        "a-bb2-007",
        "a-bb2-008",
        "a-bb2-009",
        "a-bb2-010"
      ]
    },
    "part2": {
      "title": "Partie 2 — Exercices",
      "description": "Deux exercices indépendants, ~1h40 recommandées au total.",
      "totalMarks": 14,
      "exerciseIds": ["e-transverse-bb2-001", "e-transverse-bb2-002"]
    },
    "tags": ["standard", "sujets-zero"]
  },
  {
    "id": "bb-2026-03",
    "title": "Bac blanc n°3",
    "subtitle": "Sujet d'entraînement — fin d'année (plus exigeant)",
    "order": 3,
    "durationMinutes": 120,
    "part1": {
      "title": "Partie 1 — Automatismes",
      "description": "10 questions d'automatismes, sans calculatrice, ~20 minutes recommandées.",
      "totalMarks": 6,
      "automatismIds": [
        "a-bb3-001",
        "a-bb3-002",
        "a-bb3-003",
        "a-bb3-004",
        "a-bb3-005",
        "a-bb3-006",
        "a-bb3-007",
        "a-bb3-008",
        "a-bb3-009",
        "a-bb3-010"
      ]
    },
    "part2": {
      "title": "Partie 2 — Exercices",
      "description": "Deux exercices indépendants, ~1h40 recommandées au total.",
      "totalMarks": 14,
      "exerciseIds": ["e-transverse-bb3-001", "e-transverse-bb3-002"]
    },
    "tags": ["exigeant", "synthese"]
  }
]
